{
  "$schema": "https://json-schema.org/draft/2020-12/schema",
  "$id": "https://typeanvil.com/templates/report.schema.json",
  "title": "Report data",
  "type": "object",
  "required": ["title", "author", "date", "sections"],
  "additionalProperties": false,
  "properties": {
    "title": { "type": "string", "minLength": 1, "maxLength": 120 },
    "subtitle": { "type": "string" },
    "author": { "type": "string", "minLength": 1 },
    "date": { "type": "string", "minLength": 1 },
    "kpis": {
      "type": "array",
      "maxItems": 4,
      "items": {
        "type": "object",
        "required": ["label", "value"],
        "additionalProperties": false,
        "properties": {
          "label": { "type": "string", "minLength": 1 },
          "value": { "type": ["string", "number"] }
        }
      }
    },
    "sections": {
      "type": "array",
      "minItems": 1,
      "items": {
        "type": "object",
        "required": ["heading", "paragraphs"],
        "additionalProperties": false,
        "properties": {
          "heading": { "type": "string", "minLength": 1 },
          "paragraphs": { "type": "array", "items": { "type": "string" } },
          "table": {
            "type": "object",
            "required": ["columns", "rows"],
            "additionalProperties": false,
            "properties": {
              "columns": { "type": "array", "minItems": 1, "items": { "type": "string" } },
              "rows": { "type": "array", "items": { "type": "array", "items": { "type": ["string", "number"] } } }
            }
          }
        }
      }
    }
  }
}
